tweet;jk
Mulai besok aku gaakan bawa buku paket, malu kali tiap ke sekolah tas kaya mau pindah rumah;l
jujur malu ketemu wali kelas Crying face total absen kayanya 20;l
Minggu depan libur 12 hari Partying face;l
BENER BANGET SUMPAH GA NYAMAN;l
Lucu, bagi dong;l
KENAPA PARFUM DISITA;l
Itu apaa? Kue cubit?;l
Kokumi tentu saja;l
Serem banget di rs ada nenek” jatoh di eskalator :( untung gapap;l
Bandung gajelas, sekarang panas banget tar sore hujan Pensive face;l
Nah ini, kayanya emang kewaspadaan temen” aku tuh gaada ato gimana sih :’) mau pake masker pasti dikatain alay;l
di ui jurusan apa kaa?;l
terus bisa dicari deh cos tan nya;l
Itu yg no 1 kan sin itu depan/miring, berarti depannya 1 miringnya 4, tinggal dicari pake phytagoras samping nya;l
kesel banget sama temen yg nularin sakit;l
Saking takutnya, gw nge-charge hp pake powerbank, padahal stop kontak ada deket Slightly smiling faceSlightly smiling face;l
Gatau aku emang penakut di kamar sendiri Loudly crying face padahal kalo siang biasa aja;l
Nge charge hp pake powerbank di kasur*;l
seru!! deg-degan sumpah;l
Tergantung dibentak siapa;l
Aku level 1 aja lumayan banyak deh;l
Caper, malu nder sama yg iph 7 ke atas;l
pengen nyobain yg dark, tapi kalo di print lebar tinta Neutral face;l
pusing demam ketularan temen Pensive face mau belajar pts gabisa huhu;l
zen & quipper Persevering face rg terlalu lama menurutku dan jadi bingung soalnya ga to the point;l
Aku pake rg quipper zen Rolling on the floor laughing;l
Aku sukanya dimakan polos Persevering face ga pake apa-apa;l
HUA @edcfess2 jadi keren;l
pusing ngeliat tl pada berantem gegara youtube :(;l
ya x itu x nya dibaca apa sih? Sering nemu soalnya Thinking face ;l
Kirim di bdgfess coba nder;l
Kayanya aku terakhir denger itu 2018 Pleading face;l
Yg red velvet enak sih tapi kemanisan Pensive face;l
Wah iya xing fu tang pake itu?;l
(Baru mau bikin anak);l
jangan nakutin Pleading face;l
bagus biar sekolah bubar kalo gitu;l
Abis kelas 12 us;l
kesel udh buru-buru ke sekolah kirain telat, taunya masih sepi Slightly smiling faceSlightly smiling face;l
Ke dokter Loudly crying face;l
eh aku kira atta beneran Rolling on the floor laughing;l
Kalo udh kelas akhir gt pasti dilulusin ko;l
Dulu belajar inggrisnya sendiri atau ikut lesss? Ko keren banget Loudly crying face;l
hujan, males sekolah Tired face;l
tapi di ips juga ada ngitung Frowning face;l
please ada voice season 4 Loudly crying face;l
Salfok mejanya Loudly crying face;l
Aku kira kamu ngelawak, itu boneka... ternyata beneran Face without mouth;l
kandang idaman hamster, apa daya aku dulu kandangnya yg biasa aja Disappointed face kasian sekali hamster ku menderita dulu;l
Romantic doctor 2 itu nyambung sama yg 1 ga sih?;l
Kenapa rata” drama jadi tayang di netflix ya;l
Ini tuh aku bingung yg terakhir, kenapa negara nya dihancurin?;l
ternyata barang yg disita itu dibawa pulang toh;l
Keliatan baikk bangett ayahnya Pleading facePleading face;l
11, kelas 10 masih sedikit bocah Tired face tiap hari ada mulu masalah ama temen;l
kapan aku stop membuang duit ortu ku Pleading face;l
di train to busan juga ada ga sih;l
OOH JADI DIAAA, PANTES GA ASING;l
sumpah ini pasti cacingnya berat banget buat digerakin Pensive face;l
Dengerin musik pake earphone ato nonton yt, ga belajar soalnya lebih masuk otak belajar di rumah;l
Dua-duanya gampang, asal bukan tempe Sleepy face;l
dari sekarang, tanyain dulu syarat-syaratnya apa ajaa;l
LUCU BANGET Loudly crying face;l
emang suka gitu, kadang ada yg ga minta ganti tapi ada juga yg minta ganti;l
Gakuat jalannya macet terus Face with symbols over mouth;l
Percaya deh, un smp itu lebih gampang daripada to.;l
mau pulang, gamau olahraga Frowning face;l
Selasa juga please fisika + matematika Pouting face;l
tiap ngeliat berita orang meninggal jujur takut banget.. aku gamau ortu aku ninggalin duluan Loudly crying face;l
iyaa sumpah takut banget ga siap Loudly crying face;l
Hah baru tau spotify ada liriknya;l
kaya lebih mending aku yg meninggal duluan daripada mereka Disappointed face;l
base-base lain ayo dong gini jga Pleading face https://twitter.com/aiuruto/status/1229763548789661696;l
Iya ini bener sumpah Frowning face kenapa ya bangunan inten rata” kurang bagus malah ada yg bocor dong Disappointed face;l
BENERR ini aku pernah pas smp belajr tapi sumpah ga ngerti apa apa tetep wkwk;l
Okeyy thanks buat sarannya Kissing face with closed eyes;l
pusing ngeliatnya juga Tired face;l
Sumpah dari dulu aku juga ga suka sunda Loudly crying face;l
Tentu saja, kalo masuk tar ngeganggu dong berisik;l
hah maksud ending parasite gimana sih Loudly crying face;l
puji syukur guru fisika uprakin kelas 12 Pleading facePleading face;l
38+ kalo bisa 39 karena skrng zonasi jadi kuota nem dikit banget Slightly smiling face;l
this sounds good Pleading face;l
kaya jalur undangan gitu tapi buat kelas internasional ui;l
Sumpah aku nyari” hewannya Slightly smiling face;l
6/10 enak tapi b aja ga special sama sekali;l
Jaehyun Sehun Hyunjin Minhyun V;l
AKU, pake roti+nutella, gabisa makan nasi di bawah jam 12 siang pokonya;l
kenapa sekolahku kelas 12 to ga libur Crying faceCrying faceCrying face capeq;l
kesel ya ga Crying face;l
belum nonton dilan  Crying face;l
guru aku kebanyakan dari sini;l
enak buat tidur gimana dah;l
enak tapi kaya ga kerasa strawberrynya;l
nyampe sekolah jam 7 Smiling face with open mouth;l
aku suka gini, tapi pas udh di sekolah malah enjoy sama temen”. Pas di rumah males lagi besok Slightly smiling face gitu aja berulang;l
aku asalnya mau ga masuk tapi....;l
Jangan bahas lagi please ini udh 2020 Disappointed face;l
kangen bulan desember Crying face;l
You, jujur ngantuk dari episode 1;l
kenapa kamu ngebully temen sampe ortunya dateng Tired face;l
dan yg dimainin cuman 1 Crying face worms zone;l
Itu kenapa tiktok dimasukin ke game Face without mouth;l
ooh HAHAH, iyaa lucu makanya aku beli Pensive face;l
enak aja Pouting face;l
baru tau klo kebanyakan pke tangan Pleading face aku juga pake sendok kalo nasi padang soalnya nasinya berair sama sambel gt nder;l
Itu kena colokan masih sempet foto Slightly smiling faceSlightly smiling face;l
Enak tapi aku lebih suka yg di suki-suki sih;l
tapi sumpah ko ada cacing...;l
Emng dari dulu warnanya gt deh?;l
btw aku juga tau ini dari komik miko HAHA;l
