tweet;jk
Inovatif dan Kreatif menjadi salah satu kunci utama untuk menghadapi perang ekonomi MEA pada era Industri 4.0. #IndustrialStrategy;l
Demokratik yang terlalu demokrasi akan menyebabkan pesatnya pertumbuhan Otokratik.;l
'Takut' selalu berhasil membentuk rasa protective. Jaga! Kendalikan! Jangan sampai layu menjadi mati rasa.;l
Lagu lama yang selalu diputar. Terlanjur basi tapi terasa menggelegar. Untuk kalangan bawah yang masih butuh dasar. Tak lain tujuannya untuk sadar. Sehingga dapat menentukan yang benar.;l
Kesakitan, keperihan, kenaasan pasti akan tiba. Hanya saja bagaimana kesiapan kita untuk menghadapinya. Bukan perihal melawan, tapi menahan.;l
Saat rakyat tertidur begitu lelap dalam buaian penguasa, maka mahasiswa harus berdiri tegap. Bukan di belakang mereka, tapi jauh di depan mereka. Dengan satu nada 'Kembalikan Indonesia'. #demokrasimatimahasiswabangkit;l
Selingkuh memang menyakitkan. Bukan hanya dalam keluarga, tapi juga dalam negara.;l
Bahagia itu sederhana. Katanya.;l
Dimanapun dan kapanpun, kejujuran adalah modal utama sehingga timbul rasa percaya. Terutama pemimpin.;l
materi pelajaran yang ku ingat setelah lulus;l
ketika sudah lama pacaran lalu diam-diam ditinggal rabi #ambyar;l
coba ganti laptop lain coba ganti kabel usbnya hardisknya bunyi cetek2 engga? hardisknya kerasa geter/muter engga?;l
paling2 dpt axioo atau merk yg udh stop produksi nder atau laptop2 dengan prosesor core 2 duo/dual core, biasanya penyakitnya batre udh soak. atau netbook prosesor intel atom. compare aja cb total perbaikan lcd vs beli laptop budget 800rb lebih worth mana;l
dreamweaver dikit cm buat bikin script web dasar, setelah jd edit pake sublime plus framework bootstrap VMware/VirtualBox buat ubuntu virtual foxit reader/phantom, xampp khatam buat trial n ngoprek program2 berbasis web, sayangnya masih bingung pake perl kalo di windows;l
parafrase kutipannya, yg penting presentase similarity nya ga lebih dari standar yg ditentukan, tempatku batas maksimal similarity nya 25%, kalo mau cek turnitin atau tanya2 info bisa dm;l
lanjut dm mbak. ini masuk engga judulnya?;l
masuk dong tidak ada kata terlambat untuk belajar;l
pulang aja, bsok izin sama dosen, kalo dosennya ga percaya kirimin bukti khitannya;l
"seekor kucing di bully oleh dua ekor ayam headline lain ""kucing ini ketahuan memakan anak ayam, lihat bagaimana orang tua ayam ini membalasnya""";l
"nanti radit cerita tentang ""kisah si radit di alam lain""";l
pelatihan penanganan kebakaran, pelatihan evakuasi gempa;l
interstellar akibat ga nurut orang tua kamar ku tembus ke dimensi lain.;l
laboran, bisa di dinas pertanian, dinas kehutanan, balai konservasi hewan/bksda, balai pembibitan tanaman;l
tergantung berita dari bpbd terkait status merapi, sama kondisi abu vulkanik.;l
kalo pajak taunan cm butuh stnk sama ktp pemilik aja, kalo pajak 5 taunan bisa di gesek no rangka di samsat terdekat, hasil cek no rangka dikirim ke daerah asal beserta stnk, ktp, bpkb;l
enakan pake mendeley nder, dapus ke generate otomatis sesuai body note yg kita cantumkan di pengutipan;l
lanjutkan kerjakan, skripsi yang bagus adalah skripsi yang selesai, yang penting ga diprotes dosbing karena judulnya udah mainstream/banyak dibahas di skripsi2 sebelumnya, jadi lanjut aja, kalo dosbing dr awal bilang ganti judul karena penelitiannya udh sering maka harus ganti;l
ketiduran di kelas lain dr matkul yg sebelum dhuhur dan ga ada satu temen pun yg bangunin;l
beda-beda cari jam yg enak dan jeda ga terlalu lama kalo bisa kamis jum'at libur tapi resiko kalo tigas numpuk stress, kuliah seharian 4 matkul capek;l
cari di emerald, wiley, elsevier, taylor n francis, pubmed, copy doi/linknya masukkan ke sci hub;l
lebih enak minta duit waktu jaman kecil dulu daripada nyari duit waktu udah dewasa;l
tergantung settingan akun turnitinnya kak, kalau di set no repository apapun yg di upload buat di cek ga akan nambah ke database jadi data kita yg ke upload aman ga akan nambah persenan waktu ngecek kedua kali dst;l
selamat anda mendapatkan tabungan dari diri anda di masa lalu;l
"pengalaman horror di kampus, kehilangan tupperware waktu jam jeda kuliah siang, sorenya di wa Ibu ""mas tupperware tempat minumnya Ibu yang hitam jangan sampai hilang ya""";l
temenku malah ga peduli ada yg dateng apa engga yg penting dia bisa lulus sidang, lulus kuliah, wisuda. esensinya kan yg penting lulus sidang. btw selamat ya sudah lulus sidang, semangat revisian nder.;l
apa tidak lebih bermanfaat diisi begini daripada kosong bang;l
ac ny deket bgt nder mending ac dipindah di atas lemari;l
rata2 masih buka rekrut S2 ya, karena rekrut dosen kualifikasi s3 itu susah ya, dan menggaji dosen berpendidikan s3 itu ga sedikit apalagi kampusnya swasta, jadi biasanya kalopun wajib dosen harus s3 ada opsi bisa kuliah lg dengan biaya sendiri ijin belajar atau dibantu institusi;l
mungkin di dalem kamar ada tikus lagi baku hantam;l
ini buah nanas nana nana nanas jabrik hijau rambutnya ini buah nanas nana nana nanas kuning bersisik kulitnya;l
lenovo bagus tp body kebanyakan plastik jelek, asus cakep body banyak metal tp batre gampang soak, keyboard kadang2, hp engga deh, acer apalagi;l
laif hek kamu ga rela stik drumnya mama jadiin gagang spatula? kalo ga rela mulai besok mama ga akan masak lagi ;l
"kayanya setelah tau si cowo tunangan sama cew lain dia jadi ngarep, mngkin karena ""skrg udh lama ga ad chat""";l
beda prinsip fundamental hidup aku suka mi goreng dia suka mi goreng yang dikasih kuah;l
sampe sekarang gue masih parno keluar dari kamar mandi, soalnya waktu itu pernah keluar dari kamar mandi trus dipalak duit 2000;l
sama nder, barusan aku ngubur miyung mati yg kejepit ditumpukan kayu, karena kayanya udh skitar 2 harian mati nya dan udah berbau jadi langsung tak kubur.;l
semoga yang dikarantina dinyatakan baik-baik saja dan bisa segera pulang bertemu dengan keluarga masing-masing;l
auto jadi bahan ghibahan di grup wa dosen, fakultas, senat akademi;l
kuliah s1 perawat 4 taun ples ners 2 taun;l
makin pusing dah anak teknik yang semester 9-10 baru lulus;l
kalo kaya gitu fakboi terus ini apa? fakboi balita gitu? mau ngapel cewe balita yang diapelin eh bentar ya aku ganti pampers dulu yaa udah penuh ini ;l
hangout nya ke mbak2 yg jualan bubur nasi tim, sarapan bareng;l
supir gerobak sapi sebutannya...jangan dibawa ke kampus nanti dikatain..;l
kamu boleh pakai jilbab dengan syarat: silahkan coret nama di kk ya mas dan jangan pernah anggap kami keluarga pesan ayah;l
temen yang pinjem barang tapi pas udh dibalikin dan mau dipake malah rusak dan dengan entengnya bilang pas gue pake tadi ga begini kok;l
#malamminggu pentingnya mengenali pasangan anda sebelum anda menikahinya. yg waktu ketemuan sifatnya baik, beneran baik atau cuma kedok? perhatikanlah. anak2 tidak bisa memilih ayah/ibu yg baik, tp kita bisa memilih pasangan yg baik yg supaya menjadi orang tua yg baik.;l
ganti ke windows 8.1 aja klo gt, naik satu level, untuk laptop2 tua yg ram nya 2-4 gb pake windows 10 krasa lemotnya. jd kalo mau pake win 10 min ram 4gb kalo yg speknya emng pas2an bisa ke win 8 atau ttep di win 7 asalkan rajin update dayabase antivirusnya;l
kapok go food pas jam makan siang di warung ss jalan ky mojo nunggu sejam makanan belom jadi;l
follow @assfess terus mention akunnya @assfess tambah #quotesit ditweet yg mau dibikin quote image;l
tapi... itu udah termasuk suudzon;l
Iguana yg tidak punya harha diri dihadapan kocheng putehh ;l
ini orang cara kerja otaknya gimana sih?;l
"ciri-ciri fakboy ""aku sayang kamu lebih dari kamu aayang aku"", ""aku gak mau jahat berkepanjangan sama kamu"", ""sebenernya aku udah punya pacar"" katanya sayang kok jahat, udah tau punya pacar malah golek wedokan liyo. ncen garangan og, rasah sedih nder iseh akeh sik luwih apik";l
iya bisa liat ketentuan2 golongan ukt tahun lalu atau tahun2 sebelumnya ada berapa golongan dan tiap golongan spp nya berapa harusnya bksa dilihat;l
beli di @KFCINDONESIA aja;l
emang waktu beli alat di apotik dia bilang/mintany apa ke apotekernya;l
hawanya emang kelihatan singup, tua sebaiknya setiap mau pilih hotel cek foto2ny dan reviewnya biasany kalo udh ad yg review jelek/kotor bakal saya hindari meskipun dr segi jarak lebih dekat;l
pinter banget dah jawabnya Face with tears of joyFace with tears of joy;l
Ya Ampun dapet kompensasi hehe;l
suka menuntut hak dan kewajiban kepada pemerintah tapi hak kewajibannya sebagai mahasiswa, sebagai anggota di tugas kelompok aja ga dilaksanakan.;l
semoga dpt solusi penyelesaian yg win win solution ya para mahasiswanya, mungkin bagi para siswa siswi SMA/SMK penting ya semacam edukasi memilih perguruan tinggi yg bagus itu seperti apa sekalipun itu swasta/perguruan tinggi kecil yg isinya cm bbrapa prodi aja.;l
akun hijrah hijrah dari mantan ke gebetan baru;l
vote for hp Intel celeron N4205U prosesor lbh baru, clock speed lbh tinggi;l
ga kebayang pas lagi di toilet lantai ini muter, trs dr lantai atas eh si anu lg boker tuh, idih gilak ga sih maluny kaya apa ada juga yg lagi sholat dhuhur tuh ini lantai bergerak pindah sudut lhah kampret kiblatny berubah anying padahal udh rakaat akhir;l
anak bidik misi yg hedon tugas kelompok cm titip nama aktivis tp jarang masuk kelas, di bascamp nyepik2 mhsswi cew sampe malem politik kampus yg di monopoli sama partai trtntu ospek penuh drama ga mendidik dosen ngasih tugas dgn alasan biar mandiri padahal males ngajar;l
kampus mana nder? kalo dulu emang bnyk kaya gini model jual ijazah, cm setelah ada aturan dan administrasi terintegrasi di sistem pddikti/forlap dikti akhorny banyak yg berbenah, apalagi nomor ijazah skrg bsa divalidasi keasliannya di SiVil ristekdikti https://ijazah.ristekdikti.go.id;l
kalo bener udh 6 taun tapi masih ilegal ga punya izin pendirian, akreditasi ga ada itu sih kebangetan penyelenggara kampusnya nder, skrg prodi blm punya izin belum boleh buka pendaftaran mhs baru nder, dan setelah punya mhsw kudu ngajukan akreditasi sblm angkatan pertama lulus;l
Udah verval dan udah disetujui tapi tetep gk bisa;l
Aku verval dulu, soalnya pas coba registrasi gk bisa;l
Sama Loudly crying face;l
Semingguan dan sampe sekarang masih belum bisa registrasi Loudly crying faceLoudly crying face;l
Aku juga gini;l
Punyaku juga udah disetujui tapi tetep gk bisa registrasi masa Loudly crying face;l
Face with tears of joyFace with tears of joy;l
Sama w juga 2000 an;l
Biar gak ada yang nyontek #Gosip90an;l
Pernah dong wkwk;l
Lebih bagus ruang guru atau quipper? Mau daftar juga soalnya;l
Lah, wkwkw Face with tears of joy;l
Fb min;l
Kopterheli?;l
Bisa, gw juga dari jurusan Bahasa;l
Aku malah lebih deket sama temenku yang beda kelas;l
Apakabar gw yang dapet 48 Tired face;l
Salah kampus salah jurusan Disappointed face;l
Squidward wkwk;l
Yang jadiin gue bahan gibahan sampah banget ngentot;l
Mau nanya dong boleh gk?;l
Aku dari madrasah mba terus harus gimana?;l
Kamu udah coba verif?;l
"Iya kira"" Berapa lama ya nunggunya";l
Seriusan? Dari kapan kamu verval nya?;l
Aku juga udah di acc tapi belum bisa registrasi, gimana ya?;l
Kadang kalo ketemu kucing dijalan ngerasa kasihan gitu, pengen nge-rescue mereka, tapi sekarang gak dirumah :( kalo dirumah pasti udah kubawa pulang, walaupun kucing hasil rescue ku banyak, tapi mereka layak untuk hidup enak;l
"telfon mau bahas rencana pulang ""sapine ra iso diingu nang"" ""hah pye mak?""""sapine mati"" refleks kek auto pengen ngecancel jadwal pulang. yg sabar ya pak bu, waiting money insyaallah semoga cepet cair, biar gak nyusahin terus.";l
aku bangga pada diriku, karena bisa sarapan roti pagi ini, biasanya nggak :) selama 2 bulan kerja baru sarapan 1 kali :);l
yuk minggu depan insecure :v;l
dan ini yg gua rasain sekarang;l
halo mutual akuu, makasih ya semangatnyaaa;l
semua orang layak buat dikangenin;l
jadilah pribadi yang jujur dan pribadi yang baik, nanti masalah jodoh pasti sesuai sama pribadimu - Bapak ketika membahas jodoh;l
3 minggu setelah minggu depan, setelah sekian lama fast respon, akhirnya merasakan slowrespon;l
keknya nanti habis latsar aku auto jadi akhi akhi :);l
anjayyy, generasi baru dah pamer pamer IP :v;l
akhirnya disemangatin :);l
tadi pagi, gak tau kenapa biasanya gak sarapan fine fine aja, eh tadi laper banget. eh pas bgt ada wepe, terus sama wepenya disemprot, auto kenyang :);l
Game ini mengajarkan untuk jangan meninggalkan teman kita sendirian, karena bisa menyebabkan kematian;l
bentar lg pengumuman seksi yaaaay;l
"""reky nih auto x10, dah lah ky x10 aja"" ya pengennya sih gitu, tapi ini kakap sama kasi, maunya gimana?";l
Cumi, gurita dan sejenisnya aku pasti gak suka :) soalnya pernah mual terus mau muntah gitu. Terus trauma :);l
kita gak bisa untuk menyuruh orang stay di kita, karena orang lain punya kesibukan lain yang mungkin jauh lebih penting dari kita;l
kalo kamu bukan siapa siapanya, jangan berani ngejudge, takutnya apa yg kamu judge, sama apa yang sesungguhnya beda sebenarnya, kan malu banget gak sih, dianya gak kenapa kenapa kamu dapat dosa.;l
maaf kalo gak suka hehe, namanya juga hidup kan, ada orang yang gak suka dijudge, semakin dewasa harusnya bisa mikir apa yang sedang kita lakukan bener atau nggak, terus sesuai kenyataan atau nggak;l
ada yang ditunggu tapi bukan waktu;l
Manager Keuangan :) Sekarang......;l
Tadi tiba tiba kangen rumah, ngelamun di rooftop, terus telfon. Telfonpun bahas yg gak penting, kek kucingku lg ngapain, but kaya seru aja ngobrolinnya. Sabar ya pak bu, aa 3 bulan lg pulang;l
Makin gede, makin banyak aja kota yang dikunjungi;l
kemarin pengumuman lokasi latsar dapet Cimahi, bukannya sedih karena yg lain dapat jogja, malah kesenengan :) ya gimana ya, belom pernah ke cimahi jadi ya pengen aja. Kalo jogja udah biasa;l
tadi angkat jemuran di rooftop eh ketemu pasangan muda mudi lagi kejar kejaran di atap tetangga;l
Terngiang ngiang iklan samsung A51 sama A71 awesome screen awesome camera long lasting battery life kalo nggak S20 Ultra hmmmmmm hmmmmm hmmmmmm;l
ada yang dingin tapi bukan es;l
kejadiannya cepet banget ya za dulu, sampe aku gak sadar kalo kamu udah pergi.;l
tiba tiba keinget lagi sama Reza, udah lumayan lama ya za, udah hampir 7 tahun kita udah gak bisa sama sama.;l
Mencintai tanpa memiliki :);l
Hi muka galak, gak sia sia aku nyuci kamu dimusim hujan, sekarang kamu wangi :);l
sedih gak sih kita saling baca tweet saling ngelike juga, tapi gak ada interaksi lebih;l
ada yang ingin disampaikan tapi tidak ingin saya ketahui identitas anda? https://secreto.site/id/12101135;l
Tolonglah, kalo hujan jangan suka random gini;l
Galon bunyinya gimana?;l
Ujan ujan tiba tiba pengen mie :), mau beli malah dikasih.;l
Makan darah yang dibekuin :( Ya Allah dosaku :(;l
Gak mau lagi ah rebahan terus, kapok nanti sakit punggung, harus mulai hidup sehat :);l
kalo orang udah berumur, pasti ngerasain sakit pinggang :) semoga wp hari ini sepi;l
Wait, berarti yang pas dibintaro dulu pas dikos ada yang ketok ketok, itu bukan manusia dong wkwkwkwk;l
harus buka kitab suci, tanda ' nya bkin kesel ya Allah;l
"""tapi kan hpmu masih bagus"" Ya lu gak ngerasain njirr, gimana rasanya punya hp kentang, udah kebiasaan hidup enak";l
Kenapa sih hobi banget ngurusin hidupku :);l
Tadi dikantor, ngantuk berat, cita citaku sampe kos mau tidur. Mau tidur aja ada aja gangguanya, astagfirullah;l
Udah hampir sampe di alam mimpi, tiba tiba ada telfon, ku angkat, terus yg nelfon matiin. Janc tenan, ra mikir o;l
Udah puyeng, gak ngantuk lg kan;l
Pengen nangiss, itu ada tulisannya jilid 1 sama 2 :);l
Udah kebiasaan dari kecil kalo buat administrasi bikin apa apa selalu sendiri, eh sekali minta bantuan orang lain buat bantuin auto parno. Takut nanti salah kalo orang laij yg bikinin;l
bukan apa apa, saya pake twitter lite, jadi punten atuh teh aa;l
Bolangkuu;l
sumpah tita dari tadi ngetweet mulu, pengen ku blok :) kasihan tweet mutualku yg lain gak muncul di timelineku;l
Jadi minggu lalu random banget ngobrol sama mereka, mulai dari kehidupan dunia kerja, dunia percintaan, sampai mimpi mimpi dimasa depan;l
Lanjut, habis itu kita bahas mengenai investasi saham, udah deh. Random bgt sih ngetik kek gini, tapi emang makin gede jangan cuma main main terus yg dipikir, pengelolaan finansial, investasi dan lainnya;l
Oh iya, sama jangan gedein gengsi, emang iphone 11, samsung note 10 menggoda, tapi kalo kita ngikutin gengsi tanpa menggunakannya untuk hal yg jauh lebih berguna. Semuanya sia siaa;l
Yang buruk akan selalu teringat, sebab buruklah yang akan selalu membawa kita menuju sesuatu yang baik dan membuat kita menjadi lebih baik pula, jika kita tak hanya melihat sesuatu hal dari satu sisi saja #PenjagaAmanah #DriverJempolan #NKCTDG #NKCTHIxGojek;l
Orang orang pada mandi lama kegiatannya ngapain aja sih? Ada kuliahnya juga?;l
pulang kerja > cape > niat habis isya' langsung tidur > habis isya' gak tidur tidur > begadang kan taii;l
Ngakak astagfirullah;l
Cita citaku nanti kalo udah punya rumah sendiri, pengen rescue kucing, gak mau beli kucing, pengen rescue aja, masih banyak kucing yg kurang beruntung di mana manaa;l
Jum'at sore vs Senin Pagi;l
semua orang punya cita cita masing - masing mau nikah kek apa, jadi yaudah, kenapa diributin?;l
kenapa senin cepet banget sih Sleepy face;l
"Teh Lisa said ""Rek ini dimakan ya, soalnya di Subang gak ada McD"" Dibeliin dari Purwakarta dongCrying face";l
Jiwa perfeksionisku meronta rontaa;l
kenapa sih? kek semua yg dilakukan Nia Ramadhani kek wah gitu, please lah, kesel anjirrr;l
Ada ya kaya gini, astagaa ngakak;l
Emang asyu temen temen kek gini tuh;l
tadi adik jauhku yg di Siantar curhat tentang masalahnya. sedih banget gak bisa disamping dia buat dukung dia;l
kadang suka iri, kalo liat adek sama kakak berantem Crying face;l
Gua dibully terus, males banget kalo inget ini;l
waiting for friday Loudly crying face;l
Playlist berbentuk Wallpaper;l
"""berapa ratus juta kali saya bilang sama kamu? ya saya seneng lah Ferdi nikah sama Rahmi""- Ibu Mertua Jahad Ya Allah jauhkan hamba dari Ibu Mertua jahad Neutral face";l
Ada yang mau nyoba nanya di secretoku? Ada nih linknya http://bit.ly/3atwGut silahkan berdiskusi dengan baik yaa;l
Kalau kamu cari yang ganteng. Aku mundur buat cari siomay aja, laper;l
Semoga lancar untuk hari Jum'atnya. Mohon doanya ya sahabat twitter;l
Jika seorang insan mencintai lawan jenisnya namun keduanya tidak menemukan titik temu, maka jawabannya adalah bukan untuk saling berjodoh;l
Pingin berkata kasar tp kalau ngomong kasar bibirku nggak cocok :(;l
Ada yang mau ngaji bareng?;l
Oke saya kembali di twitter. Mohon maaf jika masih banyak salah ????;l
Okeey saya mau offline dari twittet teman-teman. Mohon maaf jika banyak salah kata dan ucap ???? pamit;l
Kamu bisa memotivasi orang tapi kamu sendirilah yang sebenarnya mengalami kesusahan;l
Mau bilang jgn terlalu ngefans berelebihan sama org. Tp sepertinya aku salah tempat kalau bilang di sini ._.;l
Semangaat kamuu! Kamu yang nggak tau buat siapa :(;l
"""Merekalah yang mendapat petunjuk Tuhannya, dan mereka itulah orang-orang yang beruntung"" - Al Baqoroh : 5 Maaf masih banyak keliru dan tidak merdu dalam melantunkan ayat sucinya :( Intinya jangan lupa satu ayat satu ayat cicil tiap hari. Semangat untuk kita semua yaa";l
Semangat Hari Minggu nitizen! #terciduk;l
Ke kampus hujan, bensin habis, tidak ada dosen, pulang basah, semoga berkah #SelasaSambat;l
Jadikan masa lalu sebagai rentetan peristiwa yang kamu abadikan bukan dijadikan sebagai kesalahan. Dan aku akan selalu mendo'akanmu untuk setiap langkah kehidupan yang kamu pilih. Kamu wanita hebat #PesanUntukMantan;l
Buat kalian yang bersedih, ayo bangkit! Kalian orang yang kuat, diuji lewat kesedihan, kelak diberikan kebahagiaan lebih. Believe Allah SWT. Semangatt! #JumatBerkah;l
Nggak tau kenapa, tiap hari bawaannya rindu terus. Buka wattpad, nulis, terus ngebayangin kalau dia nemenin disebelah. Tapi udah nggak ada ikatan #malamjumat;l
Namun ada kalanya pendapat orang lain adalah salah satu petunjuk yang diberikan Tuhan untuk mencapai sebuah kebahagiaan;l
Tinggalkan, lupakan, balikan ehem;l
Dan semoga Tuhan memberikan yang terbaik daripada yang dikehendaki manusia sebelumnya;l
Semangat pejuang!;l
Yang nanya akun wp. Ini yaa, selamat mengapresiasi bacaan saya dan terimakasih banyaaak ????;l
Nyambung kok. Tapi lama lama konsleting;l
Pengucapannya tidak cocok dengan wajah yang berkumis :(;l
Diriku sudah tidak pernah merasakan apa itu libur uasbn dll;l
Tobat nder. Mungkin kamu disuruh stop;l
Mati ingat sakit Ingatlah saat kau sulit;l
Hbd. Selamat memperpendek umur!;l
Aku nggak tahannya sama kecerahan dan kemurnian hatinya dia nder;l
Bakar aja udah!;l
Apakah dikau pernah keluar negeri? Atau kontak dgn org asing dari luar negeri? Pembawa virus saat ini banyak dari WNA bukan dari dalam. Kecuali ente pernah perjalanan ke luar negeri beberapa waktu belakangan. Pesenku, jgn berfikiran negatif. Imunmu tambah down kalau gitu;l
Baik aman tentram istimewa pokoknya. Sini main;l
Mantab. Ayo rangkulan;l
Memanfaatkan kesempitan dalam kesempatan;l
Ya solusinya yg sehat harus ngalah mbak. Tdk boleh menimbun masker banyak. Fokus untuk tenaga medis dan yang sedang mengalami musibah sakit, apapun sakitnya. Dan perlu diketahui adanya stok saat ini ada yg diambil dari luar negeri juga. PMI juga sedang mengusahakan adanya masker;l
Selamat hari burung babang cilok!;l
Halo yang mau ke jogja. Enjoy yaaa. Selamat berbelanja dgn budget yg aman nyaman bagi uang saku. Di Jogja ramah. Pakai pakaian yg enjoy aja asal jgn telanjang aja;l
Ketika jalan hidup masing masing sudah diputuskan individunya maka orang lain harus menghormatinya. Jika merasa bahwa itu salah maka tegurlah dengan sopan tapi jika itu membuat dia nyaman maka persilahkanlah untuk melakukannya tanpa bersuudzon ria;l
Nah kan mulai paranoid. Hati hati lohhh. Itu bikin sistem imun lu drop juga. Imun drop jadi sasaran penyakit;l
Diriku mengajak kalian juga untuk mengkonsumsi rempah. Bisa dibuat minum kek sereh, kunyit, jahe, kunir, dan lain sebagainya atau bisa dijadikan masakan. Itu menaikkan imunitas guys. Serius, seger banget setelah konsumsi itu. Apalagi dimix sereh, jahe, sama kunyit jadiin minum;l
Pergabutan massal di twitter bang. Tlg jangan masuk twitter lagi nanti anda ikutan mereka;l
Lu bukan customer ojol kan? Yaudah ngikut sama yg ikhlas jemput elu;l
Blm sah udah ke depan Ka'bah berduaan;l
Olahraga ringan bisa btw jika km merasa terus terpojokkan oleh omongan itu. But tujuan ibu baik sih sebenernya, agar anaknya tidak mengalami hal yg kurang mengenakkan dikesehatan pada masa tua. Jadikan hal positif aja sih, anggap aja itu kebaikan dan pengingat;l
Masih jaman punya dendam dan benci? Lebih baik stay cool dan let it flow aja tanpa harus punya ras iri dengki;l
Yaudah kalau udah comfort zonenya udud ya biarin aja. Tp kalau kmnya kurang nyaman ya ganti aja. Selow ae;l
Hijab itu batas. Jilbab itu penutup. Kalau ada yang komen gitu mending di iyain aja deh biar kelar daripada ditanggapin terus naik pitam malah cuma dpt mudorotnya doang;l
Cari yang berkualitas dan sholeh intinya. Kualitas dalam ibadah dan akhlaq;l
Ya belajar di bimbel nder. Kalau nggak sering ketemu sama temen yg pandai sastra inggris;l
Padahal kebanyakan hasil dari cinta tiktok itu adalah rekayasa yg diskenario aja atau hanya hal sebelum terjadinya sebuah perpisahan di waktu remaja. Percayalah itu :);l
Harus ditingkatkan lagi :) Semangati diriku kawan-kawan;l
Belom sesuai yang diharapkan. Terima kasih untuk Tes Diagnosis UTBK @zeniuseducation yang menyadarkan bahwa harus belajar lebih giat lagi. Yuk bisa yuk #Pejuang2020;l
Ya kan nti gw jd kepala museum;l
Setauku didalemnya ada warga AS nah itu yg ngebuat AS geram sama jerman. Pas itu AS sama Jerman itu mitra dagang. Kabarnya lusitania jg ngebawa amunis perang inggris cmiiw;l
Ali dan Bujang di serial Bumi dan Pulang;l
Ungkapin aja biar lega bor;l
WOWW, ada Monalisa sama The Last Supper. Td pgn kesini, tp kecapean gara2 atletik. Kasih rate dong, ada penjelasan kan ttg lukisannya?;l
Siapa tuh?ini kapan anjrit;l
Bsok, katanya sih di perpanjang jg;l
Sehari 2 bab, trsrh mau mapel aja;l
Udh dibilang filsafat aje;l
Itu mah situ doang, saya kgk;l
Gk mungkin klo sama dia;l
Jadi saling nikung gk nih? @retrorizme;l
Iya nih, jarang nyatet, gk pernah nyatet malah wkwkwk;l
Susah ajg, gk susah amat sih;l
Beloman bor, ini baru mau ngerjain;l
Liat contoh puisi buat bsok lomba;l
Ashura kalo di mitologi Jepang malah yg jahat, Indra yang baik. Klo di Naruto, itu dibalik sama Kishimoto.;l
Lemah bgst;l
Temanku bucin skrg;l
Apakah Monas merupakan phalus ? Sebuah objek yang menyerupai alat kelamin pria yang sedang ereksi ? Yang menggambarkan bahwa Soekarno adalah seorang flamboyan. Apakah itu benar ?;l
Nyebar paham radikal sih ;l
Di Asian Games 2018 kemaren bersatu dalam 1 bendera, sampe perwakilan pejabat saling berpegang tangan;l
Sambit temen baru di twitter, akhirnya bikin jg @FitriUt96597970 @sayyidhb1 @yemimaandria;l
Gk ah, malah gw dapet banyak ilmu di twitter;l
Apa padanan/serapan bahasa indonesia dari kata assist dari sepak bola @ivanlanin;l
Liat sumbernya :);l
Udh diganti @AyatollahFC;l
Guru” pada ga masuk gegara hujan, giliran muridnya gaboleh Face with symbols over mouth;l
pusing sekali kenapa guru di sma aku mulutnya suka gibah semua;l
Ada dan dia itu aku wkwk. Ga ko soalnya aku belajar sendiri di rumah jadi gaada nilai jelek di rapot;l
sialan ternyata digibahin guru selama 3 hari ga masuk kemarin;l
Please hujan bertahan sampe jam 9 Frowning face;l
abis lebaran Star-struck Grinning face Hocho;l
Pernah, asalnya seminggu tapi pas pulang sekolah sehabis disita aku mohon-mohon jd dibalikin wkwk;l
gapernah liat yg sebagus ini Disappointed face https://twitter.com/crystalizaal/status/1234894397117911040;l
HBD yaa Partying faceStar-struck;l
dari senin udh ga sekolah, besok mau sekolah TAPI TIBA” MUNCUL ALERGI;l
